"MANCC","TENNCC","SDT","DIACHI"
"NCC001","Công ty TNHH Quang Học Sài Gòn","0281234001","123 Võ Văn Tần, Q3, TP.HCM"
"NCC002","Công ty CP Dược Phẩm Mắt Việt","0281234002","45 Đinh Tiên Hoàng, Q1, TP.HCM"
"NCC003","Essilor Vietnam Co. Ltd","0281234003","Tầng 10 Bitexco, Q1, TP.HCM"
"NCC004","Johnson & Johnson Vision Care VN","0281234004","Khu CX Amata, Đồng Nai"
"NCC005","Công ty TNHH Thiết Bị Y Tế Minh Đức","0281234005","78 Nguyễn Bỉnh Khiêm, Q1, TP.HCM"
"NCC006","TechVision Asia Pte Ltd","0281234006","Tầng 5, Landmark 81, TP.HCM"
